{
  "registry_version": "2026-10-17",
  "registry_serial": 1,
  "published_at": "2026-10-17T00:00:00+05:30",
  "files": [
    {
      "uri": "registry.json",
      "digest": "sha-256:6eTOMdHWNO9Lxe3UOapXtAuQXYuabQYnG8Aq8JcV1U4"
    },
    {
      "uri": "../registry/conformance-authorities.json",
      "digest": "sha-256:T1PNoYwrqgwDVLtfmj7L5e0Sq02OEbqHPC8RFhICuUU"
    }
  ]
}
